{
"companhias": [
{
"codigo_cvm": "1023",
"negocios_24m": 31097614,
"pregao": "BRASIL",
"tickers": [
"BBAS3"
],
"volume_24m": 313207264629,
"volume_mensal": [
9629287809,
11528407233,
10443898856,
8872173846,
13634461416,
10370745261,
10326572850,
20699315600,
14999512956,
16211464561,
19248103732,
17563129234,
12046949035,
11014070781,
9462636803,
15704559517,
17835720109,
13859486116,
10589391652,
11029831571,
9191033857,
8899240170,
12230288105,
17816983559
],
"volume_mes_parcial": 28952084778
},
{
"codigo_cvm": "10456",
"negocios_24m": 3003218,
"pregao": "ALPARGATAS",
"tickers": [
"ALPA3",
"ALPA4"
],
"volume_24m": 11376116025,
"volume_mensal": [
379609516,
541366342,
394083476,
391550362,
280242885,
303548563,
277459680,
570427202,
373651188,
216982413,
398603615,
341465204,
484925932,
456138640,
570164386,
851918070,
540045430,
892168698,
476770847,
569157536,
494526508,
308812723,
542159170,
720337639
],
"volume_mes_parcial": 1075452083
},
{
"codigo_cvm": "10880",
"negocios_24m": 1407,
"pregao": "SONDOTECNICA",
"tickers": [
"SOND3",
"SOND5",
"SOND6"
],
"volume_24m": 2339246,
"volume_mensal": [
34892,
8519,
72590,
28709,
29830,
41109,
27932,
35455,
63008,
63111,
72313,
31515,
36620,
63643,
314120,
133384,
186451,
309277,
301265,
86424,
138957,
62475,
101425,
96222
],
"volume_mes_parcial": 259557
},
{
"codigo_cvm": "11070",
"negocios_24m": 9879,
"pregao": "WLM IND COM",
"tickers": [
"WLMM3",
"WLMM4"
],
"volume_24m": 19483128,
"volume_mensal": [
482479,
663688,
1062189,
458341,
418480,
810105,
894156,
365756,
921798,
1063804,
679268,
1372768,
1037229,
705786,
538482,
772871,
1231429,
668129,
642274,
557859,
594687,
983987,
1284496,
1273067
],
"volume_mes_parcial": 2396510
},
{
"codigo_cvm": "1120",
"negocios_24m": 29863,
"pregao": "BANESE",
"tickers": [
"BGIP3",
"BGIP4"
],
"volume_24m": 34420791,
"volume_mensal": [
447750,
441503,
421011,
2422384,
1489990,
1141970,
1381730,
1612150,
1517985,
1341199,
524018,
2198904,
1391897,
1765696,
1052432,
2372092,
947284,
1523646,
4059176,
1610253,
761791,
2112016,
934178,
949736
],
"volume_mes_parcial": 796256
},
{
"codigo_cvm": "11258",
"negocios_24m": 19577,
"pregao": "TELEBRAS",
"tickers": [
"TELB3",
"TELB4"
],
"volume_24m": 25126386,
"volume_mensal": [
894565,
1406311,
805647,
616200,
1041437,
698159,
978605,
1780971,
625758,
1516277,
1197456,
3075857,
874338,
453231,
821061,
433280,
1126353,
1096944,
417342,
497302,
579020,
312970,
2308332,
1568970
],
"volume_mes_parcial": 6574907
},
{
"codigo_cvm": "11398",
"negocios_24m": 26891,
"pregao": "CRISTAL",
"tickers": [
"CRPG3",
"CRPG5",
"CRPG6"
],
"volume_24m": 33685548,
"volume_mensal": [
1923219,
1002990,
994360,
903644,
725769,
709839,
749537,
719669,
1320476,
1002797,
969245,
3258414,
3582765,
3221436,
1285306,
1018037,
917636,
680171,
1381181,
1089430,
387567,
1826654,
1945041,
2070365
],
"volume_mes_parcial": 2050589
},
{
"codigo_cvm": "1155",
"negocios_24m": 339752,
"pregao": "BANESTES",
"tickers": [
"BEES3",
"BEES4"
],
"volume_24m": 93932302,
"volume_mensal": [
4633829,
3693472,
3296762,
3683279,
3145396,
3876849,
4060842,
3969691,
3520459,
3816899,
5283243,
5696459,
3971882,
3879844,
4052644,
4765096,
4031916,
4872259,
3858918,
2691762,
2981609,
3435863,
3548891,
3164438
],
"volume_mes_parcial": 4801156
},
{
"codigo_cvm": "11592",
"negocios_24m": 1356961,
"pregao": "UNIPAR",
"tickers": [
"UNIP3",
"UNIP5",
"UNIP6"
],
"volume_24m": 7070215086,
"volume_mensal": [
191257694,
260539972,
177878262,
134574163,
122141521,
311766668,
181032509,
200185736,
157387093,
160181171,
285078132,
345770654,
421764950,
342640925,
578708839,
386571349,
362211286,
740829935,
327085100,
290093888,
238338359,
173589292,
301210854,
379376734
],
"volume_mes_parcial": 493522944
},
{
"codigo_cvm": "1171",
"negocios_24m": 58,
"pregao": "BANPARA",
"tickers": [
"BPAR3"
],
"volume_24m": 57673,
"volume_mensal": [
0,
0,
8685,
228,
9140,
3600,
0,
0,
0,
0,
0,
2079,
182,
0,
0,
0,
220,
1433,
0,
18770,
1088,
6570,
5108,
570
],
"volume_mes_parcial": 2187
},
{
"codigo_cvm": "11762",
"negocios_24m": 2627293,
"pregao": "VULCABRAS",
"tickers": [
"VULC3"
],
"volume_24m": 9679742927,
"volume_mensal": [
180683447,
258743057,
232150900,
317163837,
178790161,
240426452,
236943395,
414877687,
228654966,
249515350,
456961837,
509453511,
517344404,
555461499,
421888265,
630577773,
572984813,
735702913,
429935434,
422830786,
365614593,
296553332,
394110541,
832373974
],
"volume_mes_parcial": 966410783
},
{
"codigo_cvm": "11932",
"negocios_24m": 2342385,
"pregao": "IOCHP-MAXION",
"tickers": [
"MYPK3"
],
"volume_24m": 6188786488,
"volume_mensal": [
266963992,
347158238,
234506269,
318153313,
227685582,
263235040,
286036637,
267625573,
209333561,
264556830,
250543775,
348761751,
325571706,
358165127,
248727298,
322212182,
238557849,
270038086,
296531395,
185496855,
192440926,
153369141,
155291716,
157823646
],
"volume_mes_parcial": 274116509
},
{
"codigo_cvm": "11975",
"negocios_24m": 1401489,
"pregao": "AZEVEDO",
"tickers": [
"AZEV3",
"AZEV4"
],
"volume_24m": 2674371850,
"volume_mensal": [
82459214,
58485884,
103442098,
111729359,
423209901,
177588663,
105664819,
117426987,
38235082,
70330401,
36505258,
47892120,
49597647,
65340651,
48748595,
74306861,
24014096,
37042225,
25815228,
13619115,
18214264,
142441666,
547262749,
254998967
],
"volume_mes_parcial": 268454214
},
{
"codigo_cvm": "11991",
"negocios_24m": 3859,
"pregao": "WETZEL S/A",
"tickers": [
"MWET3",
"MWET4"
],
"volume_24m": 8290547,
"volume_mensal": [
66554,
946240,
184625,
95264,
56225,
99836,
44858,
336875,
67502,
92443,
112567,
175049,
142994,
129529,
107253,
162542,
3507270,
1075820,
137207,
54620,
21746,
8368,
235057,
430103
],
"volume_mes_parcial": 5787
},
{
"codigo_cvm": "1210",
"negocios_24m": 2726050,
"pregao": "BANRISUL",
"tickers": [
"BRSR3",
"BRSR5",
"BRSR6"
],
"volume_24m": 10747978193,
"volume_mensal": [
268488469,
296210659,
290653837,
396090842,
337069138,
369654697,
251628441,
372840789,
281164968,
302120455,
324109992,
345128368,
269602236,
300223303,
543044636,
619315944,
581965290,
871158211,
652813014,
506895459,
895561220,
322377351,
359268615,
990592259
],
"volume_mes_parcial": 909414720
},
{
"codigo_cvm": "12190",
"negocios_24m": 258042,
"pregao": "BOMBRIL",
"tickers": [
"BOBR4"
],
"volume_24m": 51879904,
"volume_mensal": [
7581917,
5430961,
3798232,
10375023,
11375697,
3213247,
3709701,
1846937,
362506,
243635,
271117,
284597,
146600,
523781,
161650,
394494,
112820,
190335,
162221,
97582,
46384,
41978,
483625,
1024864
],
"volume_mes_parcial": 646135
},
{
"codigo_cvm": "1228",
"negocios_24m": 8399,
"pregao": "NORD BRASIL",
"tickers": [
"BNBR3"
],
"volume_24m": 14201953,
"volume_mensal": [
456438,
104505,
389186,
184376,
544045,
246243,
315910,
407374,
613618,
283042,
1400916,
506895,
480725,
425374,
367027,
1765183,
576709,
783709,
746984,
759377,
1133222,
559416,
767978,
383701
],
"volume_mes_parcial": 712695
},
{
"codigo_cvm": "12572",
"negocios_24m": 2394302,
"pregao": "RECRUSUL",
"tickers": [
"RCSL3",
"RCSL4"
],
"volume_24m": 5410074071,
"volume_mensal": [
286246559,
361478675,
392502452,
395260634,
172353943,
169554176,
145700032,
138022422,
59809182,
126041809,
66526264,
63966307,
91709336,
121028518,
537710344,
974241407,
668346279,
284317146,
66513689,
43214312,
56162707,
59616176,
91122951,
38628751
],
"volume_mes_parcial": 28132575
},
{
"codigo_cvm": "12653",
"negocios_24m": 14266467,
"pregao": "KLABIN S/A",
"tickers": [
"KLBN11",
"KLBN3",
"KLBN4"
],
"volume_24m": 57186235017,
"volume_mensal": [
2602559212,
2505217824,
2907132780,
2264869416,
1871894491,
2019205472,
2662484768,
2226036911,
2188432499,
2059095147,
1814656855,
2390871331,
2619626137,
2097242552,
2917683565,
2398728229,
2802779415,
2317153562,
2624116665,
2598871786,
2371056372,
2053175454,
2408135264,
2465209310
],
"volume_mes_parcial": 3369201873
},
{
"codigo_cvm": "12696",
"negocios_24m": 7350,
"pregao": "SANSUY",
"tickers": [
"SNSY3",
"SNSY5",
"SNSY6"
],
"volume_24m": 7305291,
"volume_mensal": [
653934,
540194,
268155,
181194,
121772,
1042704,
521827,
778449,
238018,
535450,
149208,
55723,
201482,
136550,
134688,
101665,
211882,
188825,
141145,
81890,
247053,
464005,
208225,
101253
],
"volume_mes_parcial": 182848
},
{
"codigo_cvm": "12823",
"negocios_24m": 9,
"pregao": "ALIPERTI",
"tickers": [
"APTI4"
],
"volume_24m": 36000,
"volume_mensal": [
0,
0,
0,
0,
0,
0,
4000,
20000,
4000,
4000,
4000,
0,
0,
0,
0,
0,
0,
0,
0,
0,
0,
0,
0,
0
],
"volume_mes_parcial": 0
},
{
"codigo_cvm": "1309",
"negocios_24m": 10014,
"pregao": "MERC INVEST",
"tickers": [
"BMIN3",
"BMIN4"
],
"volume_24m": 7365571,
"volume_mensal": [
121211,
43039,
107361,
235453,
4331024,
194272,
107786,
91113,
28046,
37395,
66064,
112736,
49760,
64845,
200685,
74946,
83877,
1044332,
148328,
24492,
44680,
31990,
73004,
49132
],
"volume_mes_parcial": 26249
},
{
"codigo_cvm": "1325",
"negocios_24m": 193383,
"pregao": "MERCANTIL",
"tickers": [
"BMEB3",
"BMEB4"
],
"volume_24m": 833272102,
"volume_mensal": [
37350828,
26881034,
22750600,
15302662,
12223927,
8436926,
10495760,
14366765,
10014573,
9474551,
19409842,
24519441,
19059444,
21583274,
66480649,
61816159,
59574566,
78824369,
49197747,
60942960,
57150957,
51212422,
56870114,
39332532
],
"volume_mes_parcial": 63646801
},
{
"codigo_cvm": "13285",
"negocios_24m": 991,
"pregao": "JOSAPAR",
"tickers": [
"JOPA3",
"JOPA4"
],
"volume_24m": 854589,
"volume_mensal": [
25595,
30643,
7824,
13670,
7980,
8690,
40978,
21857,
87652,
2967,
3777,
6148,
10185,
16318,
4808,
1553,
17698,
1986,
383842,
29426,
26193,
95562,
546,
8691
],
"volume_mes_parcial": 22934
},
{
"codigo_cvm": "13366",
"negocios_24m": 26341,
"pregao": "HAGA S/A",
"tickers": [
"HAGA3",
"HAGA4"
],
"volume_24m": 14335917,
"volume_mensal": [
2046708,
624031,
488431,
241200,
220086,
338586,
402948,
200838,
259410,
263414,
156135,
260713,
332735,
224431,
217507,
289652,
477018,
1072030,
1137087,
1198004,
990520,
619118,
1215884,
1059431
],
"volume_mes_parcial": 1141839
},
{
"codigo_cvm": "13439",
"negocios_24m": 14536,
"pregao": "RIOSULENSE",